200,,,LW,OP,"Scattered trees in an oil palm landscape: Density, size and distribution","['Korol, Y', 'Khokthong, W', 'Zemp, DC', 'Irawan, B', 'Kreft, H', 'H√∂lscher, D']",Global Ecology and Conservation,2021,10.1016/j.gecco.2021.e01688,"In tropical landscapes dominated by oil palm monocultures, scattered trees can contribute to biodiversity, regulate diverse ecosystem functions and deliver goods and services. However, basic quantitative information about such trees is often lacking. The objectives of our study were to identify the landscape-wide density and distribution patterns of scattered trees in an oil-palmdominated area of Sumatra (Indonesia), and to estimate their size. The study area with the total of 1120 ha was situated in Jambi province in the lowlands of Sumatra. In 2016, the year of our assessment, 83% of the area was covered by oil palm monocultures including industrial and smallholder plantations; other land-use types included rubber plantations and secondary forests. An earlier land-use classification suggests that oil palm cultivation began before 1990 on 41% of the area. The study area was mapped in 2016 using a fixed-wing drone equipped with red-greenblue and near-infrared cameras. We counted all visible trees in the aerial image. In the entire study region, we detected 10.1 scattered trees/ha. In areas where oil palm plantations were established before 1990, the tree density was 67% lower than in the area where oil palm was introduced later. The median tree crown diameter was 4.5 m, which corresponds to an estimated diameter at breast height of 12 cm; thus, most trees were small-statured. The trees were spatially clustered and often aligned along roads and rivers. In conclusion, we found a considerable number of scattered, mostly small-statured trees. This suggests that most trees were young and disappeared before reaching larger dimensions. To ensure the survival of trees and further provision of related ecosystem services, scattered trees in the oil palm landscape need to be conserved and/or restored.",Indonesia,Germany,Wet tropical,Forest,"Jambi Province, Sumatra, Indonesia","01.95° S, 103.25° E",from study,-1.95; 103.25,Fixed-wing,"Aero M (3D Robotics, USA)","RGB, NIR",Canon PowerShot SX260 HS for RGB; same camera type with modified Rosco #2007 filter for NIR,0.1 m,".1 m, .1 m",1120 ha,1120 ha,Drone mission in Oct 2016; flight altitude 300 m a.s.l.; 50% side and 50% forward overlap; orthophotos generated/georeferenced in Agisoft; mosaics compiled and color-balanced (PCI Geomatica). Land-use map created by supervised maximum likelihood classification with ground-truthing (100 locations); map resampled to 10 m for land-use classification and accuracy assessment performed (504 reference points; 84% accuracy).,no,October 2016,1 scan,"Land-use history inferred using a 1990 Landsat-based map (Melati 2017) to distinguish “SE-oil palm early” vs “NW-oil palm late,” and Google Earth Pro imagery (from 2002 onward) to classify plantation age (<15 vs ≥15 years in 2016).",300 m,"Tree Density, Tree Count, Canopy height, Tree Crown Diameter","Satellite-based land-use history (Melati 2017; Landsat 1990), Google Earth time slices for plantation age, field ground-truthing points for land-use classification, and regression relationships based on prior studies (Harapan rainforest; EFForTS-BEE).","Forest structure/dynamics, Canopy composition","To identify density (n/ha) and spatial distribution of scattered trees; analyze crown structure/size, and discuss influence of land-use history.",Detected 10.1 scattered trees/ha across the region; density 67% lower where oil palm established before 1990; median crown diameter 4.5 m (mostly small trees); trees spatially clustered and often aligned along roads and rivers.,"Fixed-wing UAV RGB+NIR orthophotos enabled complete landscape-wide detection/counting of visible scattered trees, measurement of crown diameters, and assessment of spatial distribution across a 1120 ha oil palm landscape.",Detailed in Methods.,not reported,not reported
205,,,LW,OP,An Approach for Detecting Mangrove Areas and Mapping Species Using Multispectral Drone Imagery and Deep Learning,"['Chen, XY', 'Zhang, XY', 'Zhuang, CW', 'Dai, XJ', 'Kong, LL', 'Xie, ZX', 'Hu, XB']",Senors,2025,10.3390/s25082540,"Mangrove ecosystems are important in tropical and subtropical coastal zones, contributing to marine biodiversity and maintaining marine ecological balance. It is crucial to develop more efficient, intelligent, and accurate monitoring methods for mangroves to understand better and protect mangrove ecosystems. This study promotes a novel model, MangroveNet, for integrating multi-scale spectral and spatial information and detecting mangrove area. In addition, we also present an improved model, AttCloudNet+, to identify the distribution of mangrove species based on high-resolution multispectral drone images. These models incorporate spectral and spatial attention mechanisms and have been shown to effectively address the limitations of traditional methods, which have been prone to inaccuracy and low efficiency in mangrove species identification. In this study, we compare the results from MangroveNet with SegNet, UNet, and DeepUNet, etc. The findings demonstrate that the MangroveNet exhibits superior generalization learning capabilities and more accurate extraction outcomes than other deep learning models. The accuracy, F1_Score, mIoU, and precision of MangroveNet were 99.13%, 98.84%, 98.11%, and 99.14%, respectively. In terms of identifying mangrove species, the prediction results from AttCloudNet+ were compared with those obtained from traditional supervised and unsupervised classifications and various machine learning and deep learning methods. These include K-means clustering, ISODATA cluster analysis, Random Forest (RF), Support Vector Machines (SVM), and others. The comparison demonstrates that the mangrove species identification results obtained using AttCloudNet+ exhibit the most optimal performance in terms of the Kappa coefficient and the overall accuracy (OA) index, reaching 0.81 and 0.87, respectively. The two comparison results confirm the effectiveness of the two models developed in this study for identifying mangroves and their species. Overall, we provide an efficient solution based on deep learning with a dual attention mechanism in the acceptable real-time monitoring of mangroves and their species using high-resolution multispectral drone imagery.",China,China,Moist tropical,Mangrove,"Zhanjiang Mangrove National Nature Reserve, China",109°40′–110°35′ E and 20°14′–21°35′ N,from study,"109.6667, 110.5833; 20.2333, 21.5833",Multi-rotor,DJI Phantom 4 RTK Multispectral,Multispectral,Phantom 4 RTK Multispectral,4.61 cm,.0461 m,42.05 ha,42.05 ha,"3726 multispectral images acquired Flight overlaps: 70% side, 80% forward Sensor elevation angle: −90° Orthophotos produced via Agisoft Metashape 2.1.1 (point cloud, DSM, orthophotos) Images/labels tiled into 512 × 512 px patches with 150 px overlap for model training Geo-correction described using five uniformly selected geographic feature control points",no,October 2023,1 scan,,100 m,Canopy Segmentation,"Manual/expert labeling (thresholding + visual interpretation for mangrove extent; direct manual labeling for species categories) Field investigation used to confirm prevalent species in the training region (e.g., Rhizophora stylosa, Aegiceras corniculatum, Sonneratia apetala, Avicennia marina)",Forest structure/dynamics,UAV-based high-resolution multispectral remote sensing + deep learning for mangrove extent detection and mangrove species mapping,"MangroveNet performance reported as Accuracy 99.13%, F1 98.84%, mIoU 98.11%, Precision 99.14% AttCloudNet+ species mapping reported with Kappa 0.81 and Overall Accuracy 0.87 (and class-wise performance discussed in the conclusion)","Provides the high-resolution multispectral imagery enabling (i) accurate mangrove extent extraction and (ii) species-level mapping that is difficult with coarser satellite imagery, supporting “real-time/near-real-time” monitoring goals as framed by the authors",Detailed in Methods.,not reported,not reported
206,,,LW,OP,Effective integration of drone technology for mapping and managing palm species in the Peruvian Amazon,"['Casapia, XT', 'Cardenas-Vigo, R', 'Marcos, D', 'Gamarra, EF', 'Bartholomeus, H', 'Coronado, ENH', 'Porles, SD', 'Falen, L', 'Palacios, S', 'Tsenbazar, NE', 'Mitchell, G', 'Diaz, AD', 'Draper, FC', 'Llampazo, GF', 'Perez-Pena, P', 'Chipana, G', 'Torres, DD', 'Herold, M', 'Baker, TR']",Natue communication,2025,10.1038/s41467-025-58358-5,"Remote sensing data could increase the value of tropical forest resources by helping to map economically important species. However, current tools lack precision over large areas, and remain inaccessible to stakeholders. Here, we work with the Protected Areas Authority of Peru to develop and implement precise, landscape-scale, species-level methods to assess the distribution and abundance of economically important arborescent Amazonian palms using field data, visible-spectrum drone imagery and deep learning. We compare the costs and time needed to inventory and develop sustainable fruit harvesting plans in two communities using traditional plot-based and our drone-based methods. Our approach detects individual palms of three species, even when densely clustered (average overall score, 74%), with high accuracy and completeness for Mauritia flexuosa (precision; 99% and recall; 81%). Compared to plot-based methods, our drone-based approach reduces costs per hectare of an inventory of Mauritia flexuosa for a management plan by 99% (USD 5 ha-1 versus USD 411 ha-1), and reduces total operational costs and personnel time to develop a management plan by 23% and 36%, respectively. These findings demonstrate how tailoring technology to the scale and precision required for management, and involvement of stakeholders at all stages, can help expand sustainable management in the tropics.",Peru,Peru,Wet tropical,Forest,"National Service of Protected Areas – SERNANP, Loreto, Peru",not reported,,not reported,"Commercial, Multi-rotor","DJI Phantom 4 Pro, DJI Phantom 4 RTK, DJI Mavic 2",RGB,not reported,10 cm,.1 m,230 ha,230 ha,"80–90% forward/side overlap, mostly nadir camera angle (90°). Pix4DMapper used for mosaicking. 89 UAV mosaics total (training/validation set). Uses superpixel crown partitioning to delineate crowns and speed labeling; crown labels linked to GPS points; tiles of 512×512 px created; extensive data augmentation to improve generalisation.",yes,2017–2022,1 scan,Training/validation UAV data were collected concurrently with ground reference data. Flights intentionally varied in height to expose models to multiple spatial resolutions.,60–150 m,"Canopy Cover, Canopy Segmentation, Canopy density",Ground reference GPS data for 5089 palms (3 species) with ~5 m average GPS error (2017–2019); some reference data from RAINFOR plots (via ForestPlots.net). Also includes SERNANP cost and personnel-time data for plot-based vs UAV-based inventory and management-plan workflows.,Forest structure/dynamics,"To automate detection and quantification of three palm species (Mauritia flexuosa, Oenocarpus bataua, Euterpe precatoria) using field data + RGB UAV mosaics + CNNs, and (ii) demonstrate a cost- and time-effective, implementable approach for SERNANP to build sustainable harvesting management plans.",Demonstrated species-level detection and individual counting over landscape scales (70–230 ha mosaics). Reported highest performance for Mauritia flexuosa (very high precision and strong recall relative to other species). UAV-based approach reduced inventory cost per hectare dramatically (plot-based vs UAV-based comparison) and reduced total operational costs and staff time for management plan development.,"Core data source enabling very-high-resolution, landscape-scale species mapping, crown delineation, and abundance estimation, supporting operational inventories used directly in management planning by the national protected areas authority.",not reported,The UAV mosaics and their details can be found at 4TU ResearchData [https://doi.org/10.4121/70a8cec0-dfa7-4963-ba8a-612e738ec0cb.v1],The code for training the model and making predictions is available at Code Ocean [https://doi.org/10.24433/CO.0764353.v1]
211,,,LW,OP,Comparison of RFE-DL and stacking ensemble learning algorithms for classifying mangrove species on UAV multispectral images,"['Fu, BL', 'He, X', 'Yao, H', 'Liang, YY', 'Deng, TF', 'He, HC', 'Fan, DL', 'Lan, GW', 'He, W']",International Journal of Applied Earth Observation and Geoinformation,2022,10.1016/j.jag.2022.102890,"Mangroves are highly productive wetland ecosystems, located at the interlocking area of tropical and subtropical coastal zones. Accurately mapping the distribution, quality and quantity of species are crucial for mangrove management, protection, and restoration. This study proposed a mangrove species mapping approach by combining recursive feature elimination (RFE) with deep learning (DL) algorithms, and further assess the effectiveness of feature selection for DL (DeeplabV3+ and PSPNet) algorithm to improve classification accuracy under the high dimensional UAV image datasets. We constructed an ensemble learning models (SEL) by stacking five base models (Random Forest, XGBoost, LightGBM, CatBoost, and AdaBoost), and evaluate the classification ability of mangrove species between SEL and RFE-DL algorithms. Comparison of the classifications of mangrove species was to evaluate the accuracy differences between SEL and base models. Results indicated that: (1) RFE algorithm could improve the classification accuracy of DL algorithms. RFE-DL models using the optimal features achieved 94.8% of overall accuracy (OA), which was 0.2%-8.5% higher than only using the original multispectral bands; (2) SEL algorithm produced better classification performance than RFE-DL with a higher 1.6%-12.7% of overall accuracy. Mcnemar’s test showed the classifications of mangrove species were significant differences between the three algorithms; (3) the SEL algorithm had a strong and stable ability for classifying mangrove species. The OA of six classification scenarios was from 75.5% to 92.2%, and the highest OA using SEL algorithm was 0.8%-4.2% higher than base models; (4) XGBoost algorithm had the highest importance, while AdaBoost had the lowest importance in the SEL-based classifications.",China,China,Moist tropical,Mangrove,"Guangxi Zhuang Autonomous Region, China","08°50′50″E-108°52′17″E, 21°37′02″N-21°38′21″N",from study,21.617222–21.639167; 108.847222–108.871389,Multi-rotor,"DJI Matrice 210, Phantom4-M","RGB, Multispectral",RGB: Zenmuse X4S. Multispectral: MicaSense RedEdge MX,not reported,,156 ha,156 ha,"Main flights: 100 m AGL, 80% forward overlap and 80% side overlap, images every 3 s, acquisition window 10:00–15:00 (UTC+8), clear skies. 6 GCPs collected using V90 GPS-RTK; mosaicking/DSM/DOM in Pix4Dmapper with radiometric calibration using a MicaSense calibration target; low-overlap images (<70%) removed.",no,January 08–13 2021,1 scan,"Field surveys conducted Nov 19–25 2020, Jan 08–14 2021, and Apr 04–16 2021; UAV imagery specifically collected Jan 08–13 2021.",100 m (DJI Matrice 210 main imagery). 30 m (Phantom4-M transect imagery for visual interpretation),"NDVI, NDWI, EVI, SAVI, Vegetation indices, Canopy Segmentation","Ground reference data: 1866 samples across 8 classes (AM, KC, AC, Water body, Mudflat, Dead mangrove, Spartina alterniflora, Others) collected via 1 m × 1 m sampling squares with GPS-RTK and 9 low-altitude transect image sets; GCPs for photogrammetry.",Forest structure/dynamics,"Mangrove species mapping/classification using UAV multispectral imagery: comparison of RFE + deep learning (DeepLabV3+, PSPNet) vs stacking ensemble learning","(i) RFE improved DL accuracy (OA gains ~0.2%–9.8% vs using multispectral bands only); (ii) stacking ensemble achieved higher performance than RFE-DL overall (reported OA up to ~0.954 and 0.970 for two test sections; scenario-based stacking OA up to 0.922); (iii) multi-source feature fusion (VIs, texture, DSM) improved classification, with VIs and DSM particularly influential.","Primary data source enabling (a) high-resolution multispectral/RGB mapping, (b) generation of DSM/DOM and derived features (VIs, textures), and (c) model training/validation for species-level mangrove and invasive species mapping.",not reported,not reported,not reported
218,,,LW,OP,"Estimation of mangrove heights and aboveground biomass using UAV-LiDAR, Sentinel-1 and ZY-3 stereo images","['Fu, BL', 'Wei, YY', 'Jiang, LH', 'Yao, H', 'Li, XM', 'Yang, YL', 'Jia, MM', 'Sun, WW']",Ecological Informatics,2025,10.1016/j.ecoinf.2025.103160,"Mangroves are crucial blue carbon ecosystems that are essential for promoting sustainable global development. Tree height is a key indicator of mangrove health; however, accurately estimating mangrove height in complex coastal environments is challenging. In this study, we constructed mangrove height inversion models using multiple types of remote sensing data and machine learning algorithms (partial least squares regression (PLSR), random forest (RF), and mixture density network (MDN)). We evaluated the performance of UAV-LiDAR point clouds, ZY-3 stereo images, and Sentinel-1 polarimetric and interferometric data in mangrove height inversion, and explored the accuracy differences among the dominant species. We also estimated the aboveground biomass of different dominant mangrove species to better understand their ecological functions and health conditions. The results showed the following: (1) The canopy height model and height variables of the LiDAR point clouds, DVI and near-infrared bands of the ZY-3 stereo images, and polarimetric decomposition parameters of the Sentinel-1 SAR images were more sensitive to mangrove heights. (2) The LiDAR point clouds and Sentinel-1 SAR images achieved the highest inversion accuracy when using the RF algorithm, with R2 values of 0.875 and 0.685, respectively. The ZY-3 stereo images based on MDN obtained the optimal inversion results (R2 = 0.719), with an improvement ranging from 0.143 to 0.198 when compared to the PLSR and RF algorithms. (3) Avicennia marina was associated with the highest estimation accuracy (R2 = 0.897) compared to the other dominant mangrove species. Aegiceras corniculatum and Avicennia marina were associated with the highest inversion accuracy within the height range of 2–3 m (R2 = 0.925, R2 = 0.814, respectively), whereas Kandelia candel yielded the optimal inversion results at the height range of 1–2 m (R2 = 0.652). (4) The aboveground biomass of Aegiceras cornicatum and Kandelia candel ranged from 20.176 to 103.164 Mg/ha and 132.019 to 719.226 Mg/ha, respectively, and the aboveground biomass of Avicennia marina was mainly distributed within the range of 169.916 to 803.204 Mg/ha. Our study provides a reference for monitoring the heights and health of mangroves, as well as their protection and development.",China,China,"Moist tropical, Wet tropical",Mangrove,"Shajiao Mangrove Nature Reserve, China","21°37′13″N-21°38′15″N, 108°50′57″E-108°52′8″E",from study,21.620278 to 21.637500; 108.849167 to 108.868889,not reported,not reported,LiDAR,not reported,not reported,,not reported,,,no,Jan 6–15 2021 and Mar 30–Apr 6 2021.,1 scan,,not reported,"Canopy Height Model, Canopy height, Biomass Estimation",Field-measured tree heights and crown breadths for three dominant species (total 408 sample points) + RTK GPS coordinates for sample locations.,Forest structure/dynamics,"Estimating mangrove canopy/tree height (and biomass) using multi-source remote sensing and machine learning, with evaluation across dominant species and height gradients.",Avicennia marina achieved highest height-estimation accuracy (reported R² = 0.897) using LiDAR point clouds.,"UAV LiDAR point clouds are a primary data source for height inversion and for downstream AGB estimation/mapping, and are benchmarked against other platforms (ZY-3 stereo; Sentinel-1 SAR).",not reported,not reported,not reported
35,,,HJ,OP,Biomass Estimation Using 3D Data from Unmanned Aerial Vehicle Imagery in a Tropical Woodland,"['Kachamba, DJ', 'Orka, HO', 'Gobakken, T', 'Eid, T', 'Mwase, W']","Remote Sensing, MDPI",2016,10.3390/rs8110968,"Application of 3D data derived from images captured using unmanned aerial vehicles (UAVs) in forest biomass estimation has shown great potential in reducing costs and improving the estimates. However, such data have never been tested in miombo woodlands. UAV-based biomass estimation relies on the availability of reliable digital terrain models (DTMs). The main objective of this study was to evaluate application of 3D data derived from UAV imagery in biomass estimation and to compare impacts of DTMs generated based on different methods and parameter settings. Biomass was modeled using data acquired from 107 sample plots in a forest reserve in miombo woodlands of Malawi. The results indicated that there are no significant differences (p = 0.985) between tested DTMs except for that based on shuttle radar topography mission (SRTM). A model developed using unsupervised ground filtering based on a grid search approach, had the smallest root mean square error (RMSE) of 46.7% of a mean biomass value of 38.99 Mg·ha−1. Amongst the independent variables, maximum canopy height (Hmax) was the most frequently selected. In addition, all models included spectral variables incorporating the three color bands red, green and blue. The study has demonstrated that UAV acquired image data can be used in biomass estimation in miombo woodlands using automatically generated DTMs.",Malawi,Norway,Dry tropical,Forest,"Muyobe forest reserve, Malawi","11°35′S, 33°65′E",from study,"-11.35, 33.65",Fixed-wing,SenseFly eBee,RGB,Canon IXUS127 HS (16.1 MP),not reported,,486 ha,486 ha,Flight planning in eMotion 2 (v2.4) using Bing basemap; 4 flight blocks over 4 days; side overlap 90% and forward overlap 80%; flight height 325 m; image counts per day/block reported,no,23–26 April 2015,1 scan,Flights executed as multiple blocks per day across the 4-day window,325 m,"Above ground biomass, Canopy density",Ground reference biomass/field plot data and external elevation information from SRTM for improving terrain modeling,Forest structure/dynamics,"Estimating aboveground biomass in miombo woodlands using UAV SfM point clouds, with emphasis on digital terrain model (DTM) generation in tropical forests","AGB estimation achieved relative RMSE around 32.43%, improving to 31.98% when external SRTM heights were used for DTM support. Most suitable DTM approach (in the reported conclusion) involved supervised classification, and SRTM-based terrain information improved results.",UAV imagery enabled SfM reconstruction of 3D point clouds used to derive canopy structure metrics and build AGB models; it also allowed testing DTM-generation strategies relevant when ground points are sparse/absent,Detailed in Methods.,not reported,not reported
