161,,,HJ,LW,Infestation dynamics of Triatoma dimidiata in highly deforested tropical dry forest regions of Guatemala,"Daniel Penados, José Pineda, Michelle Catalan, Miguel Avila, Lori Stevens, Emmanuel Agreda, Carlota Monroy",Memórias do Instituto Oswaldo Cruz,2020,10.1590/0074-02760200203,"BACKGROUND Deforestation, driven by anthropogenic change in land use, influences the behaviour and abundance of vectorborne diseases. For various species of Chagas disease vectors, there is evidence that change in land use affects population density and abundance. Triatoma dimidiata is the most important Chagas vector in Guatemala, and at least one million people live in T. dimidiata endemic areas; however, infestation dynamics vary among regions, from high infestation with all life stages to low seasonal infestation by sylvatic adults. OBJECTIVES The aim of this study was to evaluate how land-use, combined with domiciliary risk factors, influences the infestation dynamics of T. dimidiata for four villages in a dry forest region with a strong deforestation history. METHODS Land use, measured with drone and satellite images, was classified into four categories (houses, monocultures and pastures, woodland and shrubland, and bare soil). Domiciliary risk factors and infestation were assessed through entomological surveys. Statistical analyses compared infestation indices and the ability of land use and domiciliary risk factors to explain infestation. FINDINGS Two villages had significantly higher infestation (26 and 30% vs. 5 and 6%), yet all villages had high colonisation (71-100% of infested houses had immature insects), with no significant difference among them. Because of the high level of deforestation across the study area, land use was not related to infestation; however, domiciliary risk factors were. A model based on four weighted domiciliary risk factors (adobe or bajareque walls, intradomicile animals, intradomicile clutter, and dirt floors) explains the infestation risk. MAIN CONCLUSIONS Because almost all infested houses have reproducing populations in this deforested dry forest region and statistical analysis identified the domiciliary risk factors for infestation, intermediate and long-term control of Chagas disease vectors in this region requires management of these risk factors.",Guatemala,Guatemala,Dry tropical,Forest,"Comapa, Jutiapa (Anonito, Ixcanal II, San Ramon, El Naranjo)","14.27323391230033, -89.87897979265365",approximate,"14.273234, -89.878980",Multi-rotor,DJI Phantom 3 Advanced,RGB,Integrated,12 cm/pixel,.12 m,4 villages (area not specified),,4 villages with household sampling and land use classification,no,Single survey (2018),Single survey (2018),Systematic house search 2018,300 m,Canopy Cover,Sentinel-2B imagery; Entomological surveys; CAP surveys,"Animal ecology, Forest structure/dynamics",To evaluate how land-use and domiciliary risk factors influence Triatoma dimidiata infestation in Guatemala,"Land use was not related to infestation due to high deforestation. Domiciliary risk factors (wall cracks, clutter) explained infestation risk.","Drone imagery used to classify land use categories (houses, crops, woodland, bare soil) around villages for vector ecology analysis.",not reported,NA,not reported
167,,,HJ,LW,Seeing the Forest for the Trees: Mapping Cover and Counting Trees from Aerial Images of a Mangrove Forest Using Artificial Intelligence,"Daniel Schürholz, Gustavo Adolfo Castellanos-Galindo, Elisa Casella, Juan Carlos Mejía-Rentería, Arjun Chennu",Remote Sensing,2023,10.3390/rs15133334,"Mangrove forests provide valuable ecosystem services to coastal communities across tropical and subtropical regions. Current anthropogenic stressors threaten these ecosystems and urge researchers to create improved monitoring methods for better environmental management. Recent efforts that have focused on automatically quantifying the above-ground biomass using image analysis have found some success on high resolution imagery of mangrove forests that have sparse vegetation. In this study, we focus on stands of mangrove forests with dense vegetation consisting of the endemic Pelliciera rhizophorae and the more widespread Rhizophora mangle mangrove species located in the remote Utria National Park in the Colombian Pacific coast. Our developed workflow used consumer-grade Unoccupied Aerial System (UAS) imagery of the mangrove forests, from which large orthophoto mosaics and digital surface models are built. We apply convolutional neural networks (CNNs) for instance segmentation to accurately delineate (33% instance average precision) individual tree canopies for the Pelliciera rhizophorae species. We also apply CNNs for semantic segmentation to accurately identify (97% precision and 87% recall) the area coverage of the Rhizophora mangle mangrove tree species as well as the area coverage of surrounding mud and water land-cover classes. We provide a novel algorithm for merging predicted instance segmentation tiles of trees to recover tree shapes and sizes in overlapping border regions of tiles. Using the automatically segmented ground areas we interpolate their height from the digital surface model to generate a digital elevation model, significantly reducing the effort for ground pixel selection. Finally, we calculate a canopy height model from the digital surface and elevation models and combine it with the inventory of Pelliciera rhizophorae trees to derive the height of each individual mangrove tree. The resulting inventory of a mangrove forest, with individual P. rhizophorae tree height information, as well as crown shape and size descriptions, enables the use of allometric equations to calculate important monitoring metrics, such as above-ground biomass and carbon stocks.",Colombia,Germany,Wet tropical,Mangrove,"Utría National Park (La Chunga North, Terron Colorado, Estero Grande Shore)","6.018037751642747, -77.34591719163333",from study,"6.018038, -77.345917",Multi-rotor,"DJI Phantom 4, DJI Mavic Pro",RGB,"DJI FC330, DJI FC220","3.64 cm/px, 3.27 cm/px, 5.83 cm/px",.0425 m,not reported,,Mangrove sites with tree-level mapping,no,Single campaign (Feb 2019),Single campaign,Mangrove survey (date not specified),not reported,Tree Count; Canopy Height Model; Canopy Cover; Biomass Estimation,GNSS,Forest structure/dynamics,To develop a workflow for mapping and counting individual mangrove trees and calculating above-ground biomass using UAV imagery and CNNs,"Deep learning networks successfully delineated individual trees (33% AP) and mapped mangrove cover (97% precision, 87% recall).",Provided high-resolution orthomosaics and DSMs for training deep learning instance and semantic segmentation models.,not reported,https://doi.org/10.1594/PANGAEA.956799,GitHub: dschuerholz/mangrove_instance_segmentation
169,,,HJ,LW,Monitoring selective logging intensities in central Africa with sentinel-1: A canopy disturbance experiment,"Chloé Dupuis, Adeline Fayolle, Jean-François Bastin, Nicolas Latte, Philippe Lejeune",Remote Sensing of Environment,2023,10.1016/j.rse.2023.113828,"Forest degradation is a major threat to tropical forests, and effective monitoring using remotely sensed data is subject to significant challenges. In particular, consistent methods for detecting subtle changes in the forest canopy structure caused by selective logging are lacking. Here, using a unique dataset collected in southeastern Cameroon, covering over 22,000 ha of monthly harvesting areas, >6000 locations of harvested trees, and an independent canopy gap dataset developed from an uninhabited aerial vehicle flight (UAV; RGB camera) of approximately 1500 ha, a new method was designed to monitor canopy disturbance and logging intensity in Central Africa. Using Sentinel-1 synthetic aperture radar (SAR) data, the method was conceptualised using a two-step, two-scale approach, which better matched logging practices. First, (non-)harvesting activity areas were identified using textural indices at a spatial resolution of 300 m (step 1), and within these harvesting activity areas, canopy gaps were detected at a resolution of 10 m (step 2). Both steps were based on monthly differences in the Sentinel-1 SAR time series computed using the average of the 12 months preceding and the average of the three months following the month of interest. This method identified harvesting activity areas (step 1 at 300 m resolution) of over 12,004 km(2) with high accuracy (omission and commission errors for both classes <= 0.05) and, within them, detected canopy gaps (step 2 at 10 m resolution) with a global accuracy of 0.89. Although some canopy gaps were subject to omission and commission errors (0.39 and 0.05, respectively), this method yielded better results than other available approaches. Compared to the UAV canopy gaps, this method detected most of the small gaps (<= 500 m(2)), which represent 80% of all disturbed areas, whereas other available approaches missed at least 70% of these and consequently missed most of the disturbance events occurring in a selectively logged forest. Furthermore, the predictions were correlated with logging intensity, i.e., the number of trees and volume cut per hectare, which are two important criteria for assessing the sustainability of logging activities. This two-step two-scale method for short-term, monthly monitoring of logging disturbances and intensity has strong practical implications for forest administration and certification bodies in Central Africa.",Cameroon,Belgium,Moist tropical,Forest,Southeastern Cameroon (Pallisco-CIFM concessions),"423469, 362361: 430647, 370982 (EPSG: 32633)",from study,"3.277353, 14.310931; 3.355153, 14.375549",not reported,not reported,RGB,not reported,10 m (Sentinel-1),10 m,~1500 ha (UAV coverage),1500 ha,Two-scale method: 300m activity areas + 10m canopy gaps,no,Single UAV flight; Sentinel-1 time series,One time point (UAV),Single UAV reference flight (1500 ha),not reported,Canopy Disturbance; Canopy Cover,Sentinel-1 SAR time series; Field harvesting data,Forest structure/dynamics,To develop a method to monitor canopy disturbance and logging intensity in Central Africa using Sentinel-1 SAR and UAV reference data,Sentinel-1 method detected harvesting activity areas with high accuracy (errors ≤0.05) and canopy gaps (global accuracy 0.89).,UAV RGB imagery provided independent reference dataset for calibrating and validating Sentinel-1 canopy gap detection method.,not reported,NA,not reported
173,,,HJ,LW,Mapping the Spatial Distribution of Fern Thickets and Vine-Laden Forests in the Landscape of Bornean Logged-Over Tropical Secondary Rainforests,"Ryuichi Takeshige, Masanori Onishi, Ryota Aoyagi, Yoshimi Sawada, Nobuo Imai, Robert Ong, Kanehiro Kitayama",Remote Sensing,2022,10.3390/rs14143354,"Forest degradation has been most frequently defined as an anthropogenic reduction in biomass compared with reference biomass in extant forests. However, so-defined ""degraded forests"" may widely vary in terms of recoverability. A prolonged loss of recoverability, commonly described as a loss of resilience, poses a true threat to global environments. In Bornean logged-over forests, dense thickets of ferns and vines have been observed to cause arrested secondary succession, and their area may indicate the extent of slow biomass recovery. Therefore, we aimed to discriminate the fern thickets and vine-laden forests from those logged-over forests without dense ferns and vines, as well as mapping their distributions, with the aid of Landsat-8 satellite imagery and machine learning modeling. During the process, we tested whether the gray-level co-occurrence matrix (GLCM) textures of Landsat data and Sentinel-1 C-band SAR data were helpful for this classification. Our study sites were Deramakot and Tangkulap Forest Reserves-commercial production forests in Sabah, Malaysian Borneo. First, we flew drones and obtained aerial images that were used as ground truth for the supervised classification. Subsequently, a machine-learning model with a gradient-boosting decision tree was iteratively tested in order to derive the best model for the classification of the vegetation. Finally, the best model was extrapolated to the entire forest reserve and used to map three classes of vegetation (fern thickets, vine-laden forests, and logged-over forests without ferns and vines) and two non-vegetation classes (bare soil and open water). The overall classification accuracy of the best model was 86.6%; however, by combining the fern and vine classes into the same category, the accuracy was improved to 91.5%. The GLCM texture variables were especially effective at separating fern/vine vegetation from the non-degraded forest, but the SAR data showed a limited effect. Our final vegetation map showed that 30.7% of the reserves were occupied by ferns or vines, which may lead to arrested succession. Considering that our study site was once certified as a well-managed forest, the area of degraded forests with a high risk of loss of resilience is expected to be much broader in other Bornean production forests.",Malaysia,Japan,Wet tropical,Forest,Deramakot and Tangkulap Forest Reserves,"5°14′–28′N, 117°20′–38′E; 5°18′–31′N, 117°11′–22′E",from study,"5.233333, 117.333333; 5.466667, 117.633333; 5.300000, 117.183333; 5.516667, 117.366667",Multi-rotor,"DJI Mavic 2 Pro, DJI Phantom 4 Pro",RGB,Integrated,not reported,,not reported,,UAV flights over degraded forest plots in Deramakot/Tangkulap,no,Single campaign (Aug-Sept 2019),Single campaign (Aug-Sept 2019),Aerial photography Aug-Sept 2019,100 m and 120 m,Canopy Cover,Landsat-8; Sentinel-1; Canopy composition,"Forest structure/dynamics, Canopy composition","To map spatial distribution of degraded forest vegetation (fern thickets, vine-laden forests) using satellite imagery",GLCM texture variables were effective for classification. 30.7% of reserves were occupied by ferns/vines indicating degradation.,UAV imagery provided ground truth for training and validating satellite-based classification of degraded forest vegetation.,not reported,NA,not reported
174,,,HJ,LW,Canopy tree mortality depends on the proportion of crown exposed to sunlight but this effect varies with species' wood density,"Luisa F. Gómez-Correa, Camila Jaramillo-Hernández, Alvaro Duque, Raquel Fernandes Araujo, Gabriel Arellano, Stuart J. Davies, Nicolas Castaño, Jörg Haarpaintner, Fabian Enßle, Daniel Zuleta",Biotropica,2023,10.1111/btp.13258,"Understanding what drives changes in tree mortality as well as the covariates influencing trees' response is a research priority to predict forest responses to global change. Here, we combined drone photogrammetry and ground-based data to assess the influence of crown exposure to light (relative to total crown area), growth deviations (relative to conspecifics), tree size, and species' wood density (as a surrogate for light-demanding and shade-tolerant life-history strategies) on the mortality of 984 canopy trees in an Amazon terra firme forest. Trees with lower wood density were less prone to die when their proportion of crown was more exposed to sunlight, but this relationship with relative crown exposure weakened and slightly reversed as wood density increased. Trees growing less than their species average had higher mortality, especially when the species' wood density decreased. The role of wood density in determining the survival of canopy trees under varying light conditions indicates differential responses of light-demanding versus shade-tolerant species. Our results highlight the importance of accounting for life-history strategies, via plant functional types, in vegetation dynamic models aiming to predict forest demography under a rapidly changing climate.Abstract in Spanish is available with online material. Comprender los factores que impulsan cambios en la mortalidad de los arboles asi como las covariables que influencian la respuesta de estos es una prioridad de investigacion para predecir las respuestas de los bosques al cambio global. En este estudio, combinamos fotogrametria de drones y datos terrestres para evaluar la influencia de la exposicion de la copa a la luz (relativo al area total de la copa), las desviaciones de la tasa de crecimiento (relativo a conespecificos), el tamano del arbol, y la densidad de la madera de la especie (como indicador de las estrategias de historia de vida demandantes de luz y tolerantes a la sombra) sobre la mortalidad de 984 arboles de dosel en un bosque de tierra firme de la Amazonia. arboles de baja densidad de la madera fueron menos propensos a morir a mayor proporcion de area de copa expuesta a la luz, pero esta relacion con la exposicion a la luz se debilito y se invirtio ligeramente a medida que aumento la densidad de la madera. arboles que crecieron menos que el promedio de su especie presentaron mayor mortalidad, especialmente cuando la densidad de la madera decrecio. El rol de la densidad de la madera en determinar la sobrevivencia de los arboles de dosel bajo diferentes condiciones de luz indica respuestas diferenciales de las especies demandantes de luz y tolerantes a la sombra. Nuestros resultados resaltan la importancia de tener en cuenta las estrategias de historia de vida, a traves de los tipos funcionales de plantas, en los modelos dinamicos de vegetacion que tienen como objetivo predecir la demografia de los bosques bajo un clima rapidamente cambiante. Is more light better? Through the integration of drone- and ground-based data, Gomez-Correa et al. found a differential effect of crown light exposure (relative to total crown area) on the mortality of canopy trees in an Amazon forest. These findings underscore the varied tree responses to specific local environmental conditions.image",Colombia,Colombia,Wet tropical,Forest,Amacayacu Forest Dynamics Plot (AFDP),3°48′33″ S; 70°16′04″ W,from study,"-3.809167, -70.267778",Fixed-wing,SenseFLY eBee,NIR,Canon PowerShot ELPH 110 HS (NIR modified),6 cm,.06 m,25 ha (AFDP plot) with 18 ha studied,18 ha,25-ha AFDP plot with tree crown mapping,no,Single RPAS flight (Dec 2013); Census 2007-2019,One time point (Dec 2013),Single RPAS flight Dec 2013,112 m,Canopy Disturbance; Canopy Cover; Tree Mortality Index; Canopy height,Ground-based census data,"Forest structure/dynamics, Plant physiological performance",To assess the influence of crown exposure to light and other variables on canopy tree mortality in Amazon terra firme forest,Trees with lower wood density were less prone to die when crown was exposed. Light exposure influenced mortality differently by life-history strategy.,Used to delineate individual tree crowns and calculate relative crown exposure to sunlight for tree mortality analysis.,not reported,NA,not reported
176,,,HJ,LW,Canopy Height and Above-Ground Biomass Retrieval in Tropical Forests Using Multi-Pass X- and C-Band Pol-InSAR Data,"Anna Berninger, Sandra Lohberger, Devin Zhang, Florian Siegert",Remote Sensing,2019,10.3390/rs11182105,"Indonesia's landscape is strongly characterized by degradation and deforestation, which results in carbon release. This makes Indonesia one of the largest carbon sources worldwide. The study at hand, investigates monitoring of canopy height and above-ground biomass (AGB) from space in Indonesian tropical forests. Using data from 2015, the canopy height and AGB were modelled in Kalimantan based on quad-pol Pol-InSAR data from RADARSAT-2 (RS-2) and dual-pol Pol-InSAR data from TerraSAR-X (TS-X). Novel algorithms utilizing the Random Volume over Ground (RVoG) interferometric model and the Random Motion over Ground (RMoG) interferometric model were tested to obtain a more accurate and robust forest parameter estimation during dry weather conditions. As a reference for modelling canopy height and AGB, extensive field inventory as well as LiDAR and drone data collected in Kalimantan were used. The RMoG model-based height inversion algorithm led to more accurate results for canopy height than the RVoG model. Using RS-2 imagery, the independent validation displayed a coefficient of determination (R-2) of 0.63 and a slight overestimation for the modelled canopy height. The modelled canopy height from TS-X data achieved an R-2 of up to 0.66 and resulted in underestimated modelled canopy height. The resulting AGB estimation based on the modelled canopy height resulted in an R-2 of 0.83 for RS-2 data and 0.84 for TS-X data. The results of the different tested images varied since the acquisition parameters and the weather conditions changed during acquisitions. It can be concluded, that not all RS-2 and TS-X data is suitable for modelling canopy height from coherence. The parameters that most affect the canopy height model were identified as the baselines (temporal and perpendicular), HoA (height of ambiguity), incident angle and moist weather conditions, as well as the wavelength. Ascending and descending flight directions did not display influence. Globally available high-resolution information about canopy height and AGB is important for carbon accounting. The present study showed that Pol-InSAR data from TS-X and RS-2 could be used together with field inventories and high-resolution data such as drone or LiDAR data to support the carbon accounting in the context of REDD+ (Reducing Emissions from Deforestation and Forest Degradation) projects.",Indonesia,Germany,Wet tropical,Forest,Sebangau National Park (Central Kalimantan),"-2.5973764973806466, 113.67343427396547",from study,"-2.597376, 113.673434",not reported,not reported,RGB,RGB with a 1/2.3” CMOS sensor and with a resolution of 4 000 × 3 000 pixel,not reported (RGB from drone),,1 km2 focus area,1 km2,1 km2 focus area with nested circular plots,no,Single campaign,Single campaign,not reported,not reported (drone); 800 m (airborne LiDAR),Canopy Height Model; Biomass Estimation; Canopy height,LiDAR (Reference); Field plots,"Forest structure/dynamics, Carbon and nutrient fluxes",To investigate the potential of multi-pass X- and C-band Pol-InSAR data for monitoring canopy height and AGB in Indonesian tropical forests,X-band InSAR height was more accurate than C-band. AGB estimation using Pol-InSAR height achieved R2=0.83-0.84.,UAV/drone provided DSM reference data combined with LiDAR DTM for validating SAR-based canopy height and AGB estimates.,not reported,NA,not reported
180,,,HJ,LW,Multi-sensor airborne lidar requires intercalibration for consistent estimation of light attenuation and plant area density,"Grégoire Vincent, Philippe Verley, Benjamin Brede, Géraldine Delaitre, Elodie Maurent, Jerome Ball, Ilona Clocher, Nicolas Barbier",Remote Sensing of Environment,2023,10.1016/j.rse.2022.113442,"Leaf area is a key structural characteristic of forest canopies because of the role of leaves in controlling many biological and physical processes occurring at the biosphere-atmosphere transition. High pulse density Airborne Laser Scanning (ALS) holds promise to provide spatially resolved and accurate estimates of plant area density (PAD) in forested landscapes, a key step in understanding forest functioning: phenology, carbon uptake, transpiration, radiative balance etc. Inconsistencies between different ALS sensors is a barrier to generating globally harmonised PAD estimates. The basic assumption on which PAD estimation is based is that light attenuation is proportional to vegetation area density. This study shows that the recorded extinction strongly depends on target detectability which is influenced by laser characteristics (power, sensitivity, wavelength). Three different airborne laser scanners were flown over a wet tropical forest at the Paracou research station in French Guiana. Different sensors, flight heights and transmitted power levels were compared. Light attenuation was retrieved with an open source ray-tracing code (http://amapvox.org). Direct comparison revealed marked differences (upto 25% difference in profile-averaged light attenuation rate and 50% difference at particular heights) that could only be explained by differences in scanner characteristics. We show how bias which may occur under various acquisition conditions can generally be mitigated by a sensor intercalibration. Alignment of light weight lidar attenuation profiles to ALS reference attenuation profiles is not always satisfactory and we discuss what are the likely sources of discrepancies. Neglecting the dependency of apparent light attenuation on scanner properties may lead to biases in estimated vegetation density commensurate to those affecting light attenuation estimates. Applying intercalibration procedures supports estimation of plant area density independent of acquisition characteristics.",French Guiana,France,Wet tropical,Forest,Paracou Research Station,5°18′ N; 52°53′ W,from study,"5.300000, -52.883333",Multi-rotor,not reported,LiDAR,"Riegl VUX-1, Riegl miniVUX-1,",not reported,,not reported,,Multi-sensor LiDAR comparison over forest site,no,Single campaign (2019-2020),Single campaign (2019-2020),Multi-sensor comparison single campaign,50-90 m (different configurations),Canopy Cover; Leaf Area Index; Canopy density,Terrestrial Laser Scanning (TLS),Forest structure/dynamics,To develop and test a method for intercalibrating multi-sensor airborne LiDAR data for plant area density estimation,Intercalibration significantly improved consistency of PAD profiles between different airborne lidar sensors.,UAV-LiDAR provided high-density point clouds for testing and validating multi-sensor intercalibration method.,not reported,NA,AMAPVox (http://amapvox.org)
