70,,,LW,HJ,Tree Height Measurements in Degraded Tropical Forests Based on UAV-LiDAR Data of Different Point Cloud Densities: A Case Study on Dacrydium pierrei in China,"['Peng, X', 'Zhao, AJ', 'Chen, YF', 'Chen, Q', 'Liu, HD']",Forests,2021,10.3390/f12030328,"Tropical forest degradation is a major contributor to greenhouse gas emissions. Tree height can be used as an important predictor of forest growth, and yield models can provide basic data for forest degradation assessments. As an important parameter of unmanned aerial vehicle-light detection and ranging (UAV-LiDAR), it is not clear how the point cloud density affects the extraction accuracy of tree height in degraded tropical rain forests. To solve this problem, we collected UAV-LiDAR data at a flight altitude of 150 m, and then resampled the UAV-LiDAR data obtained according to the point cloud density percentage resampling method and obtained UAV-LiDAR data for five different point cloud densities, namely, 12, 17, 28, 64, and 108 points/m(2). On the basis of the resampled LiDAR data, we generated a canopy height model (CHM) to extract the height of Dacrydium pierrei (D. pierrei). The results show that (1) With the increase in the point cloud density, the accuracy of tree height extraction gradually increased, with a maximum accuracy at 108 points/m(2) (root mean squared error (RMSE)% = 22.78%, bias% = 14.86%). The accuracy (RMSE%) increased by 6.92% as the point cloud density increased from 12 points/m(2) to 17 points/m(2), but only increased by 0.99% as the point cloud density increased from 17 points/m(2) to 108 points/m(2), indicating that 17 points/m(2) is a critical point for tree height extraction of D. pierrei. (2) Compared with the results from broad-leaved forests, the accuracy of D. pierrei height extraction from coniferous forest was higher. With the increase in point cloud density, the difference in the accuracy of D. pierrei height between two stands gradually increased. When the point cloud density was 108 points/m(2), the differences in RMSE% and bas% were 3.55% and 6.22%, respectively. When the point cloud density was 12 points/m(2), the differences in RMSE% and bias% were 2.71% and 4.69%, respectively. Our research identified the lowest LiDAR data point cloud density required to ensure a certain accuracy in tree height extraction, which will help scholars formulate UAV-LiDAR forest resource survey plans.",China,China,Wet tropical,Forest,Diaoluoshan National Forest Park,110°0′0′′E 19°0′0′′N,from study,,Multi-rotor,GV2000,LiDAR,LiAir1000,108 points / m2,108 ppm,1 ha,1 ha,25 plots where D. pierrei trees were planted,no,May 2018,1 scan,,150 m,Canopy Height Model,Field data for tree heights,Forest structure/dynamics,To determine the impact of LiDAR point cloud density on estimating tree height,"Height estimation accuracy increases with higher point cloud density, although there is a threshold at which accuracy increases are negligible",To create LiDAR scans with different point cloud densities,not reported,Available upon request,not reported
79,,,LW,HJ,Use of drone technology as a tool for behavioral research: A case study of crocodilian nesting,"['Evans, LJ', 'Jones, TH', 'Pang, K', 'Evans, MN', 'Saimin, S', 'Goossens, B']",Herpetological Conservation and Biology,2015,not reported,"Detecting cryptic behaviors without influencing the animal being observed is a challenging aspect of behavioral ecology. Such behaviors, often demonstrating habitat use, can play a crucial role in understanding wildlife monitoring and conservation. Crocodilian nesting is one such activity. Unmanned Aerial Vehicles (UAVs), or drones, are auto-piloted aircraft that can be used to map areas aerially using high resolution photography. Previously detectable through expensive helicopter surveys, this study sought to provide a new and less expensive method for the detection of estuarine crocodile nests in tropical forest ecosystems, as well as to propose additional applications of the technology based on field performance levels. The use of drones to detect crocodile nests is the first such application of the technology. We successfully identified two crocodile nests during the course of five flight hours (1550 ha; 15.5 km(2)) of testing along the Kinabatangan River in Sabah, Malaysian Borneo, confirming the feasibility of the technology. We located these nests in close proximity to oil palm plantations, suggesting that low-level disturbance does not provide an obstacle to successful nesting. The potential to identify nests within unprotected forest could lead to additional protected areas being listed, and the effective management of crocodile nesting habitat will also provide benefits for many additional species within the ecosystem. Other applications of the technology within lowland tropical forest could include detection of logging, enhancing anti-poaching patrols, and real-time landscape mapping.",Malaysia,"UK, Malaysia",Wet tropical,Forest,"Lower Kinabatangan Wildlife Sanctuary, Sabah, Malaysia","N5.423742◦, E118.055597◦",from study,,Fixed-wing,Bormatec-MAJA,RGB,"Model S100, Canon",8.5 cm,.085 m,not reported,,Areas where crocodiles known or expected to occur,no,14-18 Oct 2013,1 scan,flights performed during nesting season for crocodiles,300 m,Crocodile nests,Not reported,"Animal ecology, Animal identification",To use drones to identify and map nesting sites for crocodiles,"Drones are a cost-effective, non-invasive technique to facilitate mapping of crocodiles",Used to fly study area and create orthomosaics for identifying and mapping crocodile nesting sites,not reported,not reported,not reported
21,,,LW,HJ,Locating emergent trees in a tropical rainforest using data from an Unmanned Aerial Vehicle (UAV),"['Alexander, C', 'Korstjens, AH', 'Hankinson, E', 'Usher, G', 'Harrison, N', 'Nowak, MG', 'Abdullah, A', 'Wich, SA', 'Hill, RA']",International Journal of Applied Earth Observation and Geoinformation,2018,10.1016/j.jag.2018.05.024,"Emergent trees, which are taller than surrounding trees with exposed crowns, provide crucial services to several rainforest species especially to endangered primates such as gibbons and siamangs (Hylobatidae). Hylobatids show a preference for emergent trees as sleeping sites and for vocal displays, however, they are under threat from both habitat modifications and the impacts of climate change. Traditional plot-based ground surveys have limitations in detecting and mapping emergent trees across a landscape, especially in dense tropical forests. In this study, a method is developed to detect emergent trees in a tropical rainforest in Sumatra, Indonesia, using a photogrammetric point cloud derived from RGB images collected using an Unmanned Aerial Vehicle (UAV). If a treetop, identified as a local maximum in a Digital Surface Model generated from the point cloud, was higher than the surrounding treetops (Trees_EM), and its crown was exposed above its neighbours (Trees_SL; assessed using slope and circularity measures), it was identified as an emergent tree, which might therefore be selected preferentially as a sleeping tree by hylobatids. A total of 54 out of 63 trees were classified as emergent by the developed algorithm and in the field. The algorithm is based on relative height rather than canopy height (due to a lack of terrain data in photogrammetric point clouds in a rainforest environment), which makes it equally applicable to photogrammetric and airborne laser scanning point cloud data.",Indonesia,"UK, Denmark",Wet tropical,Forest,Sikundur,98.07 °E; 3.96 °N,from study,,not reported,not reported,RGB,not reported,25 cm,.25 m,6.5 km2,6.5 km2,Area with known presence of gibbons and siamangs,no,22-25 Jan 2015,1 scan,not reported,198 m,"Emergent tree location, Canopy Height Model",Not reported,"Animal ecology, Forest structure/dynamics",To identify emergent canopy trees that may be used by primates as nesting habitat with drones,Drones and the relative height algorithm provide cost-effective identification and mapping of emergenet canopy trees,Used to create orthomsaics and canopy height models which were used to identify emergent trees,not reported,not reported,not reported
59,,,LW,HJ,Mapping Canopy Heights in Dense Tropical Forests Using Low-Cost UAV-Derived Photogrammetric Point Clouds and Machine Learning Approaches,"['Zhang, H', 'Bauters, M', 'Boeckx, P', 'Van Oost, K']",Remote Sensing,2021,10.3390/rs13183777,"Tropical forests are a key component of the global carbon cycle and climate change mitigation. Field- or LiDAR-based approaches enable reliable measurements of the structure and above-ground biomass (AGB) of tropical forests. Data derived from digital aerial photogrammetry (DAP) on the unmanned aerial vehicle (UAV) platform offer several advantages over field- and LiDAR-based approaches in terms of scale and efficiency, and DAP has been presented as a viable and economical alternative in boreal or deciduous forests. However, detecting with DAP the ground in dense tropical forests, which is required for the estimation of canopy height, is currently considered highly challenging. To address this issue, we present a generally applicable method that is based on machine learning methods to identify the forest floor in DAP-derived point clouds of dense tropical forests. We capitalize on the DAP-derived high-resolution vertical forest structure to inform ground detection. We conducted UAV-DAP surveys combined with field inventories in the tropical forest of the Congo Basin. Using airborne LiDAR (ALS) for ground truthing, we present a canopy height model (CHM) generation workflow that constitutes the detection, classification and interpolation of ground points using a combination of local minima filters, supervised machine learning algorithms and TIN densification for classifying ground points using spectral and geometrical features from the UAV-based 3D data. We demonstrate that our DAP-based method provides estimates of tree heights that are identical to LiDAR-based approaches (conservatively estimated NSE = 0.88, RMSE = 1.6 m). An external validation shows that our method is capable of providing accurate and precise estimates of tree heights and AGB in dense tropical forests (DAP vs. field inventories of old forest: r(2) = 0.913, RMSE = 31.93 Mg ha(-1)). Overall, this study demonstrates that the application of cheap and easily deployable UAV-DAP platforms can be deployed without expert knowledge to generate biophysical information and advance the study and monitoring of dense tropical forests.",DR Congo,Belgium,Wet tropical,Forest,"Yangambi Biosphere Reserve, Yoko Reserve","2◦S–2◦N, 22◦E–28◦E",from study,,Multi-rotor,"DJI Mavic 2 Pro, customized DJI Phantom 3 Advanced",RGB,"Hasselblad L1D-20c RGB camera, GoPro Hero 3 RGB camera","4 cm, 10 cm",.07 m,650 ha,650 ha,not reported,no,9 - 19 Feb 2020,1 scan,not reported,180 m,Canopy Height Model,"Published ALS dataset used as reference, field-based measurements","Forest structure/dynamics, Methodological advancement",To test a workflow for improving canopy height models from UAV photogrammetry ,"Their workflow improves the ability to detect the ground in dense tropical forests from UAV photogrammetry, critical for improving canopy height models",UAV photogrammetry data collected to upscale canopy mapping,not reported,Available within supplementary material,not reported
125,,,LW,HJ,Quantifying tropical forest structure through terrestrial and UAV laser scanning fusion in Australian rainforests,"['Terryn, L', 'Calders, K', 'Bartholomeus, H', 'Bartolo, RE', 'Brede, B', ""D'hont, B"", 'Disney, M', 'Herold, M', 'Lau, A', 'Shenkin, A', 'Whiteside, TG', 'Wilkes, P', 'Verbeeck, H']",,2022,10.1016/j.rse.2022.112912,"Accurately quantifying tree and forest structure is important for monitoring and understanding terrestrial ecosystem functioning in a changing climate. The emergence of laser scanning, such as Terrestrial Laser Scanning (TLS) and Unoccupied Aerial Vehicle Laser Scanning (UAV-LS), has advanced accurate and detailed forest structural measurements. TLS generally provides very accurate measurements on the plot-scale (a few ha), whereas UAV-LS provides comparable measurements on the landscape-scale ( 10 ha). Despite the pivotal role dense tropical forests play in our climate, the strengths and limitations of TLS and UAV-LS to accurately measure structural metrics in these forests remain largely unexplored. Here, we propose to combine TLS and UAV-LS data from dense tropical forest plots to analyse how this fusion can further advance 3D structural mapping of structurally complex forests. We compared stand (vertical point distribution profiles) and tree level metrics from TLS, UAV-LS as well as their fused point cloud. The tree level metrics included the diameter at breast height (DBH), tree height (H), crown projection area (CPA), and crown volume (CV). Furthermore, we evaluated the impact of point density and number of returns for UAV-LS data acquisition. DBH measurements from TLS and UAV-LS were compared to census data. The TLS and UAV-LS based H, CPA and CV measurements were compared to those obtained from the fused point cloud. Our results for two tropical rainforest plots in Australia demonstrate that TLS can measure H, CPA and CV with an accuracy (RMSE) of 0.30 m (H-average =27.32 m), 3.06 m(2) (CPAaverage =66.74 m(2)), and 29.63 m(3) (CVaverage =318.81 m(3)) respectively. UAV-LS measures H, CPA and CV with an accuracy (RMSE) of <0.40 m, <5.50 m(2), and <30.33 m(3) respectively. However, in dense tropical forests single flight UAV-LS is unable to sample the tree stems sufficiently for DBH measurement due to a limited penetration of the canopy. TLS can determine DBH with an accuracy (RMSE) of 5.04 cm, (DBHaverage =45.08 cm), whereas UAV-LS can not. We show that in dense tropical forests stand-alone TLS is able to measure macroscopic structural tree metrics on plot-scale. We also show that UAV-LS can be used to quickly measure H, CPA, and CV of canopy trees on the landscape-scale with comparable accuracy to TLS. Hence, the fusion of TLS and UAV-LS, which can be time consuming and expensive, is not required for these purposes. However, TLS and UAV-LS fusion opens up new avenues to improve stand-alone UAV-LS structural measurements at the landscape scale by applying TLS as a local calibration tool.",Australia,Belgium,Wet tropical,Forest,"Oliver Creek, Robson Creek, Queensland",not reported,not reported,,Multi-rotor,RIEGL RiCOPTER,LiDAR,VUX-SYS system,not reported,,1.5 ha,1.5 ha,Plots with all trees >10 cm dbh tagged,no,Sep 2018,2 scans with different parameters used,not reported,90 m,"Tree DBH, Tree height, Crown volume",Terrestrial laser scanning data,"Forest structure/dynamics, Methodological advancement",To assess how the combination of terrestrial laser scanning and UAV-LiDAR perform in the measurement of forest structural metrics,"UAV LiDAR on its own is not able to accurately measure DBH, combining UAV and TLS improves the scaleability of forest structure measurement",Used to compare to TLS for tree-level structural measurement,not reported,not reported,not reported
153,,,LW,HJ,Unoccupied aerial vehicles as a tool to map lizard operative temperature in tropical environments,"['Higgins, EA', 'Boyd, DS', 'Brown, TW', 'Owen, SC', 'van der Heijden, GMF', 'Algar, AC']",Remote Sensing in Ecology and Conservation,2024,10.1002/rse2.393,"To understand how ectotherms will respond to warming temperatures, we require information on thermal habitat quality at spatial resolutions and extents relevant to the organism. Measuring thermal habitat quality is either limited to small spatial extents, such as with ground-based 3D operative temperature (Te) replicas, representing the temperature of the animal at equilibrium with its environment, or is based on microclimate derived from physical models that use land cover variables and downscale coarse climate data. We draw on aspects of both these approaches and test the ability of unoccupied aerial vehicle (UAV) data (optical RGB) to predict fine-scale heterogeneity in sub-canopy lizard (Anolis bicaorum) Te in tropical forest using random forest models. Anolis bicaorum is an endemic, critically endangered, species, facing significant threats of habitat loss and degradation, and work was conducted as part of a larger project. Our findings indicate that a model incorporating solely air temperature, measured at the centre of the 20 x 20 m plot, and ground-based leaf area index (LAI) measurements, measured at directly above the 3D replica, predicted Te well. However, a model with air temperature and UAV-derived canopy metrics performed slightly better with the added advantage of enabling the mapping of Te with continuous spatial extent at high spatial resolutions, across the whole of the UAV orthomosaic, allowing us to capture and map Te across the whole of the survey plot, rather than purely at 3D replica locations. Our work provides a feasible workflow to map sub-canopy lizard Te in tropical environments at spatial scales relevant to the organism, and across continuous areas. This can be applied to other species and can represent species within the same community that have evolved a similar thermal niche. Such methods will be imperative in risk modelling of such species to anthropogenic land cover and climate change. This study outlines a new workflow, using UAVs, to map lizard operative temperatures across landscapes at organism-relevant spatial resolutions, which until now was not possible. This workflow allows us to measure thermal suitability and heterogeneity across continuous landscapes, which is crucial to inform conservation actions for ectothermic species. Here, we use random forest models to couple UAV-derived canopy measures (texture and greenness) from RGB imagery, with sub-canopy thermal 3D replicas, to predict lizard operative temperature at solar noon. This workflow was found to work well across forest, mangrove and urban environments and allows us to measure thermal suitability across whole areas, rather than solely point-based measures from standard thermal 3D replica methods. This work provides a simple workflow to measure a directly ecologically relevant measure at relevant spatial scales, across continuous surfaces, and allows us to consider thermal habitat suitability, energetics and climate change risk for ectotherms. image",Honduras,UK,Dry tropical,Forest,"Mixed land uses across Utila, Honduras","16.0950° N, 86.9274° W",from study,,Multi-rotor,DJI Phantom 4 Advanced,RGB,"1-inch, 20-megapixel CMOS sensor mounted on a three-axis, gyro-stabilized gimbal.",0.9 cm,.009 m,0.64 ha,0.64 ha,"8 intact dry forest, 4 degraded, 4 sparsly treed",no,Mar - Jun 2019,not reported,dry season,40 - 50 m,"Habitat Suitability Score, Canopy height, Canopy density, Canopy Height Model","Microclimatic data, ground-based measurements of leaf area index","Animal ecology, Forest structure/dynamics, Forest microclimate",To model habitat quality using canopy structure and microclimatic data for an Anolis lizard,The models that incorporate UAV-derived forest structure performed better than models with purely air temperature and ground-based leaf area index measurements,Used to measure forest structure,not reported,Available within supplementary material,not reported
190,,,LW,HJ,Peering through the thicket: Effects of UAV LiDAR scanner settings and flight planning on canopy volume discovery,"['Brede, B', 'Bartholomeus, HM', 'Barbier, N', 'Pimont, F', 'Vincent, G', 'Herold, M']",International Journal of Applied Earth Observation and Geoinformation,2022,10.1016/j.jag.2022.103056,"Unoccupied aerial vehicle laser scanning (UAV-LS) has been increasingly used for forest structure assessment in recent years due to the potential to directly estimate individual tree attributes and availability of commercial solutions. However, standardised procedures for campaign planning are still largely missing. This study investigated scanner properties and flight planning to provide recommendations on minimising forest canopy occlusion and thereby maximise exploration of canopy volume. A flight campaign involving two UAV-LS systems was conducted over a dense, wet tropical forest at the Paracou research station (French Guiana). Four experiments on scanner properties and flight planning were conducted, analysed and recommendations derived. First, the scanner pulse repetition rate (PRR) should be at least 100 kHz per 1 m s-1flight speed based on 360 degrees FOV for exploration of middle canopy strata (5 m to 20 m). Higher PRR are beneficial for exploration of lower canopy (<5 m) but would need to be increased exponentially to achieve linear improvement. Alternatively, flight speed could be reduced within the constraints given by the inertial measurement unit (IMU), but would increase flight time. Second, the scanner maximum range was identified as a proxy for the laser pulse power, which positively impacts canopy exploration. This was particularly the case when using multi-return capabilities. No saturation could be observed when increasing the laser power, suggesting that this is currently a limiting factor. Additionally, a smaller laser beam divergence and pulse width were plausible reasons for better exploration of the upper canopy just below the top of canopy. Third, off-nadir scanning angles up to 20 degrees were found to result in similar occlusions, suggesting a practical FOV of 40 degrees in the investigated dense forest. This number might be larger for open canopies. UAV-LS systems with viewing geometries that focus laser pulses downwards and within optimal ranges should be preferred. Fourth, using different horizontal flight directions in the mission planning favours minimisation of occlusion. A minimum of two different flight directions is suggested. However, specific optimal yaw angles were not possible to predict before flight. Therefore, including multiple directions ensures coverage of all possible configurations. Many of these investigated features can be optimised independently from each other, and should be considered before acquisition of new UAV-LS systems and flight mission planning. These results support the establishment of general guidelines for the investment in UAV-LS systems and optimal mission planning for forest structure assessment.",French Guiana,"Germany, Netherlands",Wet tropical,Forest,Paracou Research Station,N5°18′ W52°53′,from study,,Multi-rotor,"RIEGL RiCOPTER, DJI Matrice 600 Pro",LiDAR,"VUX-1UAV scanner, YellowScan VX20 scanner",not reported,,not reported,,only from NE corner of Plot 6,no,10-21 October 2019,1 scan,not reported,not reported,Canopy occlusion,Not reported,"Forest structure/dynamics, Methodological advancement",To test different procedures for flight planning to optimize forest structure assessment with UAV-LiDAR,They provide recommendations for flight planning with UAV LiDAR for tropical forests,Used to determine the impact of different flight planning variables on forest structure assessment,Not reported,Available upon request,Not reported
102,,,LW,HJ,Characterising Termite Mounds in a Tropical Savanna with UAV Laser Scanning,"[""D'hont, B"", 'Calders, K', 'Bartholomeus, H', 'Whiteside, T', 'Bartolo, R', 'Levick, S', 'Moorthy, SMK', 'Terryn, L', 'Verbeeck, H']",Remote Sensing,2021,10.3390/rs13030476,"Termite mounds are found over vast areas in northern Australia, delivering essential ecosystem services, such as enhancing nutrient cycling and promoting biodiversity. Currently, the detection of termite mounds over large areas requires airborne laser scanning (ALS) or high-resolution satellite data, which lack precise information on termite mound shape and size. For detailed structural measurements, we generally rely on time-consuming field assessments that can only cover a limited area. In this study, we explore if unmanned aerial vehicle (UAV)-based observations can serve as a precise and scalable tool for termite mound detection and morphological characterisation. We collected a unique data set of terrestrial laser scanning (TLS) and UAV laser scanning (UAV-LS) point clouds of a woodland savanna site in Litchfield National Park (Australia). We developed an algorithm that uses several empirical parameters for the semi-automated detection of termite mounds from UAV-LS and used the TLS data set (1 ha) for benchmarking. We detected 81% and 72% of the termite mounds in the high resolution (1800 points m(-2)) and low resolution (680 points m(-2)) UAV-LS data, respectively, resulting in an average detection of eight mounds per hectare. Additionally, we successfully extracted information about mound height and volume from the UAV-LS data. The high resolution data set resulted in more accurate estimates; however, there is a trade-off between area and detectability when choosing the required resolution for termite mound detection Our results indicate that UAV-LS data can be rapidly acquired and used to monitor and map termite mounds over relatively large areas with higher spatial detail compared to airborne and spaceborne remote sensing.",Belgium,Australia,Dry tropical,Savanna,Litchfield Savanna SuperSite,,,,Multi-rotor,RIEGL RiCOPTER,LiDAR,VUX-1UAV scanner,"~2,000 / m2",2000 ppm,1 ha,1 ha,Plot with TLS data,no,not reported,2 flights conducted with different instruments,not reported,not reported,"Termite mound structure, Termite mound detection",Terrestrial laser scanning to collect benchmark dataset of mound locations and structure,"Animal ecology, Animal identification",To test the use of UAVs for measuring and detecting termite mounds in a tropical dry woodland savanna,UAVs can be rapidly and effectively used to monitor and map termite mounds over large areas,Used to compare to TLS data on termite mound locations and structures,Not reported,Available upon request,Not reported
